{"schema_version":"1.0","component":"agent","version":"0.1.0","minimum_compatible_version":"0.1.0","platform":"windows","architecture":"amd64","artifact":{"url":"https://artifacts.invalid/releases/agent.zip","sha256":"cccccccccccccccccccccccccccccccccccccccccccccccccccccccccccccccc","size_bytes":20000000,"signature":"test-signature-placeholder"},"published_at":"2026-08-14T08:00:00Z","required_after":null}
